<?xml version="1.0" encoding="UTF-8"?>
<bookstore xmlns:xsi="http://www.w3.org/2001/XMLSchema-instance"
           xsi:noNamespaceSchemaLocation="bookstore.xsd">
    <book category="Fiction">
        <title lang="en">To Kill a Mockingbird</title>
        <author>Harper Lee</author>
        <year>1960</year>
        <price>10.99</price>
    </book>
    <book category="Science Fiction">
        <title lang="en">Dune</title>
        <author>Frank Herbert</author>
        <year>1965</year>
        <price>15.99</price>
    </book>
    <book category="Fantasy">
        <title lang="en">The Hobbit</title>
        <author>J.R.R. Tolkien</author>
        <price>12.99</price>
        <year>1937</year>
    </book>
</bookstore>